{
  "$schema": "https://json-schema.org/draft/2020-12/schema",
  "type": "object",
  "properties": {
    "$schema": {
      "type": "string"
    },
    "locale": {
      "type": "string",
      "enum": [
        "en",
        "es",
        "fr",
        "de",
        "it",
        "pt"
      ]
    },
    "templateId": {
      "type": "string"
    },
    "templateVersion": {
      "type": "string"
    },
    "translationVersion": {
      "type": "string"
    },
    "translatedFromLocale": {
      "type": "string",
      "enum": [
        "en",
        "es",
        "fr",
        "de",
        "it",
        "pt"
      ]
    },
    "title": {
      "type": "string"
    },
    "subtitle": {
      "type": "string"
    },
    "description": {
      "type": "string"
    },
    "summary": {
      "type": "string"
    },
    "recommendedFor": {
      "type": "string"
    },
    "pitch": {
      "type": "string"
    },
    "learningGoals": {
      "type": "array",
      "items": {
        "type": "string"
      }
    },
    "includedMaterial": {
      "type": "array",
      "items": {
        "type": "string"
      }
    },
    "quickStart": {
      "type": "object",
      "properties": {
        "title": {
          "type": "string"
        },
        "steps": {
          "type": "array",
          "items": {
            "type": "string"
          }
        }
      },
      "required": [
        "title",
        "steps"
      ],
      "additionalProperties": false
    },
    "tags": {
      "type": "array",
      "items": {
        "type": "string"
      }
    },
    "entities": {
      "type": "object",
      "propertyNames": {
        "type": "string"
      },
      "additionalProperties": {
        "type": "object",
        "properties": {
          "title": {
            "type": "string"
          },
          "subtitle": {
            "type": "string"
          },
          "summary": {
            "type": "string"
          },
          "content": {
            "type": "string"
          },
          "status": {
            "type": "string"
          },
          "metadata": {
            "type": "object",
            "propertyNames": {
              "type": "string"
            },
            "additionalProperties": {}
          }
        },
        "required": [
          "title"
        ],
        "additionalProperties": false
      }
    },
    "relations": {
      "type": "object",
      "propertyNames": {
        "type": "string"
      },
      "additionalProperties": {
        "type": "object",
        "properties": {
          "description": {
            "type": "string"
          }
        },
        "required": [
          "description"
        ],
        "additionalProperties": false
      }
    },
    "facts": {
      "type": "object",
      "propertyNames": {
        "type": "string"
      },
      "additionalProperties": {
        "type": "object",
        "properties": {
          "statement": {
            "type": "string"
          }
        },
        "required": [
          "statement"
        ],
        "additionalProperties": false
      }
    },
    "sessions": {
      "type": "object",
      "propertyNames": {
        "type": "string"
      },
      "additionalProperties": {
        "type": "object",
        "properties": {
          "title": {
            "type": "string"
          },
          "prep": {
            "type": "object",
            "properties": {
              "summary": {
                "type": "string"
              },
              "openingPrompt": {
                "type": "string"
              },
              "goals": {
                "type": "array",
                "items": {
                  "type": "string"
                }
              },
              "notes": {
                "type": "string"
              },
              "checklist": {
                "type": "object",
                "propertyNames": {
                  "type": "string"
                },
                "additionalProperties": {
                  "type": "object",
                  "properties": {
                    "label": {
                      "type": "string"
                    }
                  },
                  "required": [
                    "label"
                  ],
                  "additionalProperties": false
                }
              }
            },
            "additionalProperties": false
          }
        },
        "additionalProperties": false
      }
    },
    "canvases": {
      "type": "object",
      "propertyNames": {
        "type": "string"
      },
      "additionalProperties": {
        "type": "object",
        "properties": {
          "title": {
            "type": "string"
          },
          "description": {
            "type": "string"
          },
          "nodes": {
            "type": "object",
            "propertyNames": {
              "type": "string"
            },
            "additionalProperties": {
              "type": "object",
              "properties": {
                "title": {
                  "type": "string"
                },
                "text": {
                  "type": "string"
                }
              },
              "additionalProperties": false
            }
          },
          "edges": {
            "type": "object",
            "propertyNames": {
              "type": "string"
            },
            "additionalProperties": {
              "type": "object",
              "properties": {
                "label": {
                  "type": "string"
                }
              },
              "additionalProperties": false
            }
          }
        },
        "additionalProperties": false
      }
    }
  },
  "required": [
    "locale",
    "templateId",
    "templateVersion",
    "translationVersion",
    "title"
  ],
  "additionalProperties": false,
  "$id": "https://dmcc.local/schemas/campaign-template/locale/v1.json"
}
