{
  "$schema": "../../../schemas/campaign-template/locale/v1.json",
  "locale": "es",
  "templateId": "oracle",
  "templateVersion": "1.2.0",
  "translationVersion": "1.1.0",
  "translatedFromLocale": "en",
  "title": "La Sombra del Oráculo",
  "subtitle": "Conspiración urbana, facciones, secretos y consecuencias",
  "description": "Campaña de investigación urbana para probar memoria narrativa, facciones, secretos revelables, relojes de presión y preparación de sesiones en Valdris.",
  "summary": "Los aventureros llegan a Valdris siguiendo una profecía que resulta ser una falsificación mágica. Para desenmascarar al Oráculo deberán conectar pistas, negociar con facciones incompatibles y decidir cómo revelar una verdad capaz de romper la ciudad.",
  "recommendedFor": "DMs que quieren dirigir una campaña densa de investigación sin preparar desde cero: ciudad viva, facciones con intereses incompatibles, pistas conectadas a secretos, relojes de presión y sesiones listas para mesa.",
  "pitch": "Una campaña de intriga fantástica centrada en Valdris, una ciudad portuaria gobernada por el miedo al Oráculo. El premade muestra cómo DMCC conecta PNJ, facciones, pistas, secretos, localizaciones y consecuencias para conservar memoria narrativa sesión a sesión.",
  "learningGoals": [
    "Usar entidades como mapa vivo de PNJ, lugares, facciones, pistas, secretos y relojes.",
    "Preparar sesiones conectando objetivos, escenas, pistas disponibles y secretos en riesgo.",
    "Separar verdades públicas, rumores y secretos del DM para alimentar el portal de jugador sin destripar la campaña.",
    "Registrar decisiones y consecuencias para que Valdris reaccione después de cada sesión.",
    "Dirigir una investigación no lineal donde varias pistas pueden revelar el mismo secreto."
  ],
  "includedMaterial": [
    "Ocho sesiones preparadas con objetivos, escenas y checklist de mesa.",
    "Facciones, PNJ, localizaciones, pistas, secretos, decisiones y consecuencias conectadas.",
    "Canvas narrativo de la conspiración de Valdris.",
    "Relojes de presión para vigilancia del culto y huida de Veradis.",
    "Hechos públicos y secretos del DM listos para revelar durante la partida."
  ],
  "quickStart": {
    "title": "Cómo empezar con La Sombra del Oráculo",
    "steps": [
      "Lee el resumen y abre el canvas de la conspiración de Valdris.",
      "Dirige la sesión 1 con tres puertas claras: audiencia del Oráculo, Taberna del Cuervo o Archivo de la Ciudad.",
      "Al final de cada sesión, marca qué pistas salieron y qué secretos quedaron en riesgo.",
      "Avanza los relojes si el grupo acusa públicamente sin pruebas o si Veradis descubre que la bóveda está en peligro.",
      "Usa la decisión final para elegir entre reforma, revuelta, huida o pacto incómodo."
    ]
  },
  "tags": [
    "intrigue",
    "factions",
    "mystery",
    "secrets",
    "urban",
    "consequences"
  ],
  "entities": {
    "ent_tpl_oracle_campaign_note": {
      "title": "Cómo usar esta campaña",
      "summary": "Dirige Valdris como una conspiración viva: las pistas abren secretos, las facciones reaccionan y cada revelación cambia la ciudad.",
      "content": "Usa el panel de campaña como control del DM. Mantén visibles las misiones y verdades públicas; conserva ocultos el fraude, la bóveda y los compromisos de facción hasta que el grupo consiga pruebas.",
      "status": "lista",
      "metadata": {
        "previewRole": "guía"
      }
    },
    "ent_tpl_oracle_valdris": {
      "title": "Ciudad de Valdris",
      "subtitle": "Ciudad portuaria gobernada por fe, comercio y miedo",
      "summary": "Ciudad costera de piedra blanca cuya estabilidad política depende de la autoridad pública del Oráculo.",
      "content": "Valdris es próspera, tensa y vigilada. Su consejo, sus templos, los gremios del puerto y las casas nobles dependen de las profecías del Oráculo, incluso cuando esas profecías arruinan vidas corrientes.",
      "status": "tensa",
      "metadata": {
        "region": "costa",
        "atmosphere": "intriga portuaria, presión religiosa, sospecha política"
      }
    },
    "ent_tpl_oracle_quest_broken_prophecy": {
      "title": "La Profecía Rota",
      "subtitle": "Arco principal de investigación",
      "summary": "La profecía que llevó a los aventureros a Valdris es una falsificación mágica y abre la puerta a una conspiración de veinte años.",
      "content": "Empieza con un documento que debería ser sagrado pero no encaja: estilo discordante, caligrafía imperfecta y pequeños detalles que no coinciden con registros antiguos del templo.",
      "status": "activa",
      "metadata": {
        "objective": "demostrar si la profecía es divina, falsa o fabricada políticamente"
      }
    },
    "ent_tpl_oracle_faction_cult": {
      "title": "Culto del Oráculo",
      "subtitle": "Fe pública, fraude oculto",
      "summary": "Orden religiosa estricta dividida entre iniciados sinceros, inquisidores brutales y un círculo interno corrupto.",
      "content": "El culto controla el miedo público mediante profecías, tasas, sermones e intimidación inquisitorial. Su cúpula sabe que el Oráculo es una construcción fraudulenta.",
      "status": "activo",
      "metadata": {
        "agenda": "preservar la autoridad del Oráculo"
      }
    },
    "ent_tpl_oracle_faction_council": {
      "title": "Consejo de la Ciudad",
      "subtitle": "Gobierno dividido entre estabilidad y reforma",
      "summary": "El consejo gobernante está dividido entre reformistas leales a Lena y conservadores comprometidos por Vantis.",
      "content": "El Consejo quiere orden por encima de todo. Algunos creen en el Oráculo; otros sospechan corrupción, pero temen que la ciudad colapse si la verdad sale mal.",
      "status": "dividido",
      "metadata": {
        "agenda": "evitar desorden civil"
      }
    },
    "ent_tpl_oracle_faction_guild": {
      "title": "Gremio de Ladrones",
      "subtitle": "Contrabando, información y supervivencia",
      "summary": "Red criminal que controla contrabando, juego e información alrededor de los muelles.",
      "content": "El Gremio teme la expansión del culto, pero no ayudará por altruismo. Sus pruebas contra Vantis son también su seguro de vida.",
      "status": "vigilante",
      "metadata": {
        "agenda": "proteger rutas del puerto y capacidad de chantaje"
      }
    },
    "ent_tpl_oracle_faction_truth_temple": {
      "title": "Templo de la Verdad",
      "subtitle": "Fe desacreditada que guarda la historia real",
      "summary": "Orden pobre y marginada que denuncia las profecías manipuladas y protege registros teológicos antiguos.",
      "content": "El templo carece de fuerza, dinero y credibilidad pública, pero conserva fuentes capaces de desmontar la teología del Oráculo.",
      "status": "marginado",
      "metadata": {
        "agenda": "restaurar la memoria verdadera"
      }
    },
    "ent_tpl_oracle_faction_merchants": {
      "title": "Consorcio de Mercaderes",
      "subtitle": "Poder comercial tras puertas educadas",
      "summary": "Coalición de familias mercantiles con gran influencia sobre aranceles, campañas del Consejo y logística portuaria.",
      "content": "El Consorcio es pragmático. No necesita que el Oráculo sea verdadero; necesita que el comercio continúe y que la información llegue antes de las votaciones públicas.",
      "status": "calculador",
      "metadata": {
        "agenda": "proteger rutas y aranceles"
      }
    },
    "ent_tpl_oracle_npc_veradis": {
      "title": "Veradis el Oráculo",
      "subtitle": "Profeta venerado en público, impostor en secreto",
      "summary": "La temida autoridad espiritual de Valdris lleva más de veinte años falsificando profecías divinas.",
      "content": "En público es sereno e intocable. En privado es Jack Corvo, un ilusionista exiliado que asesinó al verdadero vidente y construyó una mentira a escala de ciudad.",
      "status": "intocable",
      "metadata": {
        "publicMask": "oráculo sagrado",
        "privateTruth": "Jack Corvo, ilusionista impostor"
      }
    },
    "ent_tpl_oracle_npc_senra": {
      "title": "Maga Senra",
      "subtitle": "Operadora de la falsa voz divina",
      "summary": "Ilusionista que sostiene la proyección del Oráculo desde una cámara oculta, atrapada por amenazas contra su familia.",
      "content": "Si Senra deja de canalizar el cristal de resonancia, la voz y la imagen del Oráculo colapsan. Puede confesar si recibe protección.",
      "status": "coaccionada",
      "metadata": {
        "role": "operadora de ilusión",
        "leverage": "familia retenida"
      }
    },
    "ent_tpl_oracle_npc_lyra": {
      "title": "Capitana Lyra Stonehaven",
      "subtitle": "Capitana con notas secretas",
      "summary": "Investigadora honesta que sospecha del culto, pero teme que actuar sin pruebas provoque violencia civil.",
      "content": "Lyra ha documentado desapariciones en los muelles y presiones del Consejo. Puede ser una aliada clave si el grupo aporta pruebas en vez de ruido.",
      "status": "cauta",
      "metadata": {
        "role": "capitana de la guardia",
        "instinct": "proteger la ciudad antes que a sí misma"
      }
    },
    "ent_tpl_oracle_npc_kael": {
      "title": "Kael Nightblade",
      "subtitle": "Jefe del Gremio con el libro contable",
      "summary": "Líder criminal pragmático que conserva pruebas contables contra Vantis y el culto como seguro de vida.",
      "content": "Kael intercambia verdad por ventaja. Puede abrir la línea financiera de la conspiración, pero solo si el grupo acepta un pacto incómodo.",
      "status": "calculador",
      "metadata": {
        "role": "jefe del gremio",
        "asset": "libro contable paralelo"
      }
    },
    "ent_tpl_oracle_npc_vantis": {
      "title": "Lord Vantis",
      "subtitle": "Noble financiador de profecías útiles",